[
  {
    "id": "m1-demo-porcentajes-001",
    "subject": "M1",
    "skill": "Porcentajes",
    "prompt": "Una chaqueta cuesta $40.000 y tiene un descuento de 25%. ¿Cuál es su precio final?",
    "options": [
      "$10.000",
      "$25.000",
      "$30.000",
      "$35.000"
    ],
    "answerIndex": 2,
    "explanations": [
      "Calculaste el descuento y no el precio final.",
      "El descuento es $10.000: resta ese valor al precio.",
      "Correcto: $40.000 menos $10.000 es $30.000.",
      "Verifica cuánto representa el 25% de $40.000."
    ],
    "steps": [
      "25% es una cuarta parte: $40.000 ÷ 4 = $10.000.",
      "Resta el descuento: $40.000 − $10.000 = $30.000."
    ],
    "difficulty": "inicial",
    "status": "reviewed",
    "origin": {
      "type": "original",
      "rights": "owned"
    },
    "relatedIds": []
  }
]